[
  {
    "id": "marker:0001",
    "mapId": "map:forest",
    "familyId": "miscrit:20",
    "sourceName": "Waddles",
    "x": 0.263556,
    "y": 0.410497,
    "anchor": "bottom-center",
    "candidateAreaIds": [
      "location:forest:area:azore-lake"
    ],
    "areaId": "location:forest:area:azore-lake",
    "areaResolution": "unique-name-location-join",
    "provenance": {
      "sourceId": "companion-map",
      "retrievedOn": "2026-09-15",
      "method": "rendered-css-percent",
      "gameVerified": false
    }
  },
  {
    "id": "marker:0002",
    "mapId": "map:forest",
    "familyId": "miscrit:94",
    "sourceName": "Dark Nessy",
    "x": 0.426632,
    "y": 0.471228,
    "anchor": "bottom-center",
    "candidateAreaIds": [
      "location:forest:area:elder-tree"
    ],
    "areaId": "location:forest:area:elder-tree",
    "areaResolution": "unique-name-location-join",
    "provenance": {
      "sourceId": "companion-map",
      "retrievedOn": "2026-09-15",
      "method": "rendered-css-percent",
      "gameVerified": false
    }
  },
  {
    "id": "marker:0003",
    "mapId": "map:forest",
    "familyId": "miscrit:338",
    "sourceName": "Flaring",
    "x": 0.8344889999999999,
    "y": 0.546661,
    "anchor": "bottom-center",
    "candidateAreaIds": [
      "location:forest:area:magic-flower"
    ],
    "areaId": "location:forest:area:magic-flower",
    "areaResolution": "unique-name-location-join",
    "provenance": {
      "sourceId": "companion-map",
      "retrievedOn": "2026-09-15",
      "method": "rendered-css-percent",
      "gameVerified": false
    }
  },
  {
    "id": "marker:0004",
    "mapId": "map:forest",
    "familyId": "miscrit:512",
    "sourceName": "Dark Waddles",
    "x": 0.334923,
    "y": 0.487209,
    "anchor": "bottom-center",
    "candidateAreaIds": [
      "location:forest:area:azore-lake"
    ],
    "areaId": "location:forest:area:azore-lake",
    "areaResolution": "unique-name-location-join",
    "provenance": {
      "sourceId": "companion-map",
      "retrievedOn": "2026-09-15",
      "method": "rendered-css-percent",
      "gameVerified": false
    }
  },
  {
    "id": "marker:0005",
    "mapId": "map:forest",
    "familyId": "miscrit:23",
    "sourceName": "Dark Flue",
    "x": 0.49179,
    "y": 0.750358,
    "anchor": "bottom-center",
    "candidateAreaIds": [
      "location:forest:area:woodsman-s-axe"
    ],
    "areaId": "location:forest:area:woodsman-s-axe",
    "areaResolution": "unique-name-location-join",
    "provenance": {
      "sourceId": "companion-map",
      "retrievedOn": "2026-09-15",
      "method": "rendered-css-percent",
      "gameVerified": false
    }
  },
  {
    "id": "marker:0006",
    "mapId": "map:forest",
    "familyId": "miscrit:23",
    "sourceName": "Dark Flue",
    "x": 0.47387700000000005,
    "y": 0.7924479999999999,
    "anchor": "bottom-center",
    "candidateAreaIds": [
      "location:forest:area:woodsman-s-axe"
    ],
    "areaId": "location:forest:area:woodsman-s-axe",
    "areaResolution": "unique-name-location-join",
    "provenance": {
      "sourceId": "companion-map",
      "retrievedOn": "2026-09-15",
      "method": "rendered-css-percent",
      "gameVerified": false
    }
  },
  {
    "id": "marker:0007",
    "mapId": "map:forest",
    "familyId": "miscrit:20",
    "sourceName": "Waddles",
    "x": 0.272486,
    "y": 0.411704,
    "anchor": "bottom-center",
    "candidateAreaIds": [
      "location:forest:area:azore-lake"
    ],
    "areaId": "location:forest:area:azore-lake",
    "areaResolution": "unique-name-location-join",
    "provenance": {
      "sourceId": "companion-map",
      "retrievedOn": "2026-09-15",
      "method": "rendered-css-percent",
      "gameVerified": false
    }
  },
  {
    "id": "marker:0008",
    "mapId": "map:forest",
    "familyId": "miscrit:20",
    "sourceName": "Waddles",
    "x": 0.27538,
    "y": 0.438052,
    "anchor": "bottom-center",
    "candidateAreaIds": [
      "location:forest:area:azore-lake"
    ],
    "areaId": "location:forest:area:azore-lake",
    "areaResolution": "unique-name-location-join",
    "provenance": {
      "sourceId": "companion-map",
      "retrievedOn": "2026-09-15",
      "method": "rendered-css-percent",
      "gameVerified": false
    }
  },
  {
    "id": "marker:0009",
    "mapId": "map:forest",
    "familyId": "miscrit:433",
    "sourceName": "Blighted Flue",
    "x": 0.744781,
    "y": 0.07743699999999999,
    "anchor": "bottom-center",
    "candidateAreaIds": [
      "location:forest:area:elder-tree"
    ],
    "areaId": "location:forest:area:elder-tree",
    "areaResolution": "unique-name-location-join",
    "provenance": {
      "sourceId": "companion-map",
      "retrievedOn": "2026-09-15",
      "method": "rendered-css-percent",
      "gameVerified": false
    }
  },
  {
    "id": "marker:0010",
    "mapId": "map:forest",
    "familyId": "miscrit:425",
    "sourceName": "Defilio",
    "x": 0.6527379999999999,
    "y": 0.45908099999999996,
    "anchor": "bottom-center",
    "candidateAreaIds": [
      "location:forest:area:magic-flower"
    ],
    "areaId": "location:forest:area:magic-flower",
    "areaResolution": "unique-name-location-join",
    "provenance": {
      "sourceId": "companion-map",
      "retrievedOn": "2026-09-15",
      "method": "rendered-css-percent",
      "gameVerified": false
    }
  },
  {
    "id": "marker:0011",
    "mapId": "map:forest",
    "familyId": "miscrit:513",
    "sourceName": "Dark Twiggum",
    "x": 0.541019,
    "y": 0.209127,
    "anchor": "bottom-center",
    "candidateAreaIds": [
      "location:forest:area:elder-tree"
    ],
    "areaId": "location:forest:area:elder-tree",
    "areaResolution": "unique-name-location-join",
    "provenance": {
      "sourceId": "companion-map",
      "retrievedOn": "2026-09-15",
      "method": "rendered-css-percent",
      "gameVerified": false
    }
  },
  {
    "id": "marker:0012",
    "mapId": "map:forest",
    "familyId": "miscrit:93",
    "sourceName": "Mama",
    "x": 0.603715,
    "y": 0.453967,
    "anchor": "bottom-center",
    "candidateAreaIds": [
      "location:forest:area:magic-flower"
    ],
    "areaId": "location:forest:area:magic-flower",
    "areaResolution": "unique-name-location-join",
    "provenance": {
      "sourceId": "companion-map",
      "retrievedOn": "2026-09-15",
      "method": "rendered-css-percent",
      "gameVerified": false
    }
  },
  {
    "id": "marker:0013",
    "mapId": "map:forest",
    "familyId": "miscrit:430",
    "sourceName": "Blighted Cubsprout",
    "x": 0.46268099999999995,
    "y": 0.54576,
    "anchor": "bottom-center",
    "candidateAreaIds": [
      "location:forest:area:woodsman-s-axe"
    ],
    "areaId": "location:forest:area:woodsman-s-axe",
    "areaResolution": "unique-name-location-join",
    "provenance": {
      "sourceId": "companion-map",
      "retrievedOn": "2026-09-15",
      "method": "rendered-css-percent",
      "gameVerified": false
    }
  },
  {
    "id": "marker:0014",
    "mapId": "map:forest",
    "familyId": "miscrit:26",
    "sourceName": "Blazebit",
    "x": 0.538351,
    "y": 0.203373,
    "anchor": "bottom-center",
    "candidateAreaIds": [
      "location:forest:area:elder-tree"
    ],
    "areaId": "location:forest:area:elder-tree",
    "areaResolution": "unique-name-location-join",
    "provenance": {
      "sourceId": "companion-map",
      "retrievedOn": "2026-09-15",
      "method": "rendered-css-percent",
      "gameVerified": false
    }
  },
  {
    "id": "marker:0015",
    "mapId": "map:forest",
    "familyId": "miscrit:22",
    "sourceName": "Tulipinny",
    "x": 0.8321550000000001,
    "y": 0.476981,
    "anchor": "bottom-center",
    "candidateAreaIds": [
      "location:forest:area:magic-flower"
    ],
    "areaId": "location:forest:area:magic-flower",
    "areaResolution": "unique-name-location-join",
    "provenance": {
      "sourceId": "companion-map",
      "retrievedOn": "2026-09-15",
      "method": "rendered-css-percent",
      "gameVerified": false
    }
  },
  {
    "id": "marker:0016",
    "mapId": "map:forest",
    "familyId": "miscrit:507",
    "sourceName": "Dark Treemur",
    "x": 0.5,
    "y": 0.628744,
    "anchor": "bottom-center",
    "candidateAreaIds": [
      "location:forest:area:woodsman-s-axe"
    ],
    "areaId": "location:forest:area:woodsman-s-axe",
    "areaResolution": "unique-name-location-join",
    "provenance": {
      "sourceId": "companion-map",
      "retrievedOn": "2026-09-15",
      "method": "rendered-css-percent",
      "gameVerified": false
    }
  },
  {
    "id": "marker:0017",
    "mapId": "map:forest",
    "familyId": "miscrit:23",
    "sourceName": "Dark Flue",
    "x": 0.417898,
    "y": 0.797572,
    "anchor": "bottom-center",
    "candidateAreaIds": [
      "location:forest:area:woodsman-s-axe"
    ],
    "areaId": "location:forest:area:woodsman-s-axe",
    "areaResolution": "unique-name-location-join",
    "provenance": {
      "sourceId": "companion-map",
      "retrievedOn": "2026-09-15",
      "method": "rendered-css-percent",
      "gameVerified": false
    }
  },
  {
    "id": "marker:0018",
    "mapId": "map:forest",
    "familyId": "miscrit:546",
    "sourceName": "Blighted Flowerpiller",
    "x": 0.189506,
    "y": 0.321132,
    "anchor": "bottom-center",
    "candidateAreaIds": [
      "location:forest:area:elder-tree"
    ],
    "areaId": "location:forest:area:elder-tree",
    "areaResolution": "unique-name-location-join",
    "provenance": {
      "sourceId": "companion-map",
      "retrievedOn": "2026-09-15",
      "method": "rendered-css-percent",
      "gameVerified": false
    }
  },
  {
    "id": "marker:0019",
    "mapId": "map:forest",
    "familyId": "miscrit:21",
    "sourceName": "Treemur",
    "x": 0.123824,
    "y": 0.385516,
    "anchor": "bottom-center",
    "candidateAreaIds": [
      "location:forest:area:azore-lake"
    ],
    "areaId": "location:forest:area:azore-lake",